{
  "extensions": {
    "azure": {
      "alias": "pls-internal-app.a1b2c3d4-5e6f-4a7b-8c9d-0e1f2a3b4c5d.eastus.azure.privatelinkservice",
      "visibility": "Restricted",
      "auto_approval": "Restricted",
      "private_endpoint_connection_count": 1
    }
  },
  "urn": "urn:mcnet:v1:azure:subscription_id=a1b2c3d4-5e6f-4a7b-8c9d-0e1f2a3b4c5d,location=eastus,resource_group=rg-networking:endpoint:/subscriptions/a1b2c3d4-5e6f-4a7b-8c9d-0e1f2a3b4c5d/resourceGroups/rg-networking/providers/Microsoft.Network/privateLinkServices/pls-internal-app",
  "native_id": "/subscriptions/a1b2c3d4-5e6f-4a7b-8c9d-0e1f2a3b4c5d/resourceGroups/rg-networking/providers/Microsoft.Network/privateLinkServices/pls-internal-app",
  "resource_type": "endpoint",
  "provider": "azure",
  "scope": {
    "provider": "azure",
    "tenant_id": null,
    "account_id": null,
    "subscription_id": "a1b2c3d4-5e6f-4a7b-8c9d-0e1f2a3b4c5d",
    "project_id": null,
    "resource_group": "rg-networking",
    "region": null,
    "location": "eastus",
    "zone": null,
    "collected_at": "2026-08-28T12:00:00Z"
  },
  "name": "pls-internal-app",
  "tags": {},
  "observed_at": "2026-08-28T12:00:00Z",
  "source_api": "PrivateLinkServicesOperations.list_by_subscription",
  "collection_completeness": "complete",
  "endpoint_type": "producer",
  "service_name": "pls-internal-app.a1b2c3d4-5e6f-4a7b-8c9d-0e1f2a3b4c5d.eastus.azure.privatelinkservice",
  "network_urn": "urn:mcnet:v1:azure:subscription_id=a1b2c3d4-5e6f-4a7b-8c9d-0e1f2a3b4c5d,location=eastus,resource_group=rg-networking:network:/subscriptions/a1b2c3d4-5e6f-4a7b-8c9d-0e1f2a3b4c5d/resourceGroups/rg-networking/providers/Microsoft.Network/virtualNetworks/vnet-app-eastus",
  "subnet_urn": "urn:mcnet:v1:azure:subscription_id=a1b2c3d4-5e6f-4a7b-8c9d-0e1f2a3b4c5d,location=eastus,resource_group=rg-networking:subnet:/subscriptions/a1b2c3d4-5e6f-4a7b-8c9d-0e1f2a3b4c5d/resourceGroups/rg-networking/providers/Microsoft.Network/virtualNetworks/vnet-app-eastus/subnets/snet-app",
  "private_ip_addresses": [
    "10.20.1.200"
  ],
  "state": "succeeded"
}
